id,created_at,text
871929295257706499,2017-06-06 03:18:38,"The Lord will be a refuge for the oppressed, a refuge for times of trouble - Psalm 9:9"
871916530489065476,2017-06-06 02:27:54,The Lord's word is pure - Psalm 18:30.
871913827180392458,2017-06-06 02:17:10,RT @mother_know: Great advice! https://t.co/bE2kYe9ajU
871903583884726274,2017-06-06 01:36:28,A positive attitude gives you power over your circumstances instead of your circumstances having power over you.
871898729489604608,2017-06-06 01:17:10,"RT @The_Gospels: For God did not send his Son into the world to condemn the world, but to save the world through him. -John 3:17"
871890816293367809,2017-06-06 00:45:44,"Be strong &amp; take heart, all you who hope in the LORD. Psalm. 31:24"
871877894204792832,2017-06-05 23:54:23,Make every effort to live in peace with everyone and to be holy; without holiness no one will see the Lord. -Hebrews 12:14
871865286005272582,2017-06-05 23:04:17,Wishing will NEVER be a substitute for prayer.
871852433181478916,2017-06-05 22:13:12,"Praise be to the God and Father of our Lord Jesus Christ, the Father of compassion &amp; the God of all comfort. -2Cor 1:3"
871851703531909120,2017-06-05 22:10:19,RT @Women_Sports: If Found …… Please Return to the Finish Line -&gt; https://t.co/dKCwdviS5B https://t.co/oDPEEjJEbe
871839456810192896,2017-06-05 21:21:39,"If we say that we have no sin, we are deceiving ourselves and the truth is not in us. -1 John 1:8"
871838228587982848,2017-06-05 21:16:46,"RT @FaithReeI: Toddler Tells His Dog To Play With The Sprinkler, The Dog’s Reaction Is The Best!   Click&gt;&gt; &gt;https://t.co/rq6DRdbZ9P https:/…"
871826900263612416,2017-06-05 20:31:45,"Knock, &amp; the door will be opened. -Luke 11:9"
871813852652077056,2017-06-05 19:39:54,I know that God will give you whatever you ask of him. -John 11.22.
871808013606281216,2017-06-05 19:16:42,RT @The_Gospels: What are you THANKFUL for? Visit -&gt; https://t.co/1qRf0GTTd3 &amp; sign up for our daily emails. https://t.co/qVir18ojhz
871800920287440897,2017-06-05 18:48:31,Jesus replied: Love the Lord your God with all your heart &amp; with all your soul &amp; with all your mind. -Matthew 22:37
871793040205254658,2017-06-05 18:17:12,RT @Bible_Time: Selfishness is weakness. But loving and caring for others is a position of power beyond anything we can possibly imagine.
871788106650972160,2017-06-05 17:57:36,"Happy moments: Praise God

Difficult moments: Seek God

Quiet moments: Worship God

Difficult moments: Trust God

Every moment: Thank God"
871775242858967040,2017-06-05 17:06:29,"Satan seeks to defeat you by tempting you to trust your own wisdom, to live according to ur self-centered feelings and to gratify your flesh"
871762766759174149,2017-06-05 16:16:54,RT @FaithReeI: The Miracle Stairs Of Loretto Are Shrouded In The Most Amazing Unsolved Mysteries Even Today!  Click&gt;&gt;https://t.co/ckHT4bKDu…
871762402026631172,2017-06-05 16:15:27,"Jesus said to him, ""I am the way, and the truth, and the life; no one comes to the Father but through Me."" -John 14:6"
871749634468843521,2017-06-05 15:24:43,Love the Lord your God with all your heart &amp; with all your soul &amp; with all your mind &amp; with all your strength. -Mark 12:30
871736904051556355,2017-06-05 14:34:08,"God not only sees where you are, He sees where you can be."
871723931161505792,2017-06-05 13:42:35,Trusting God is more than what you can see. Walk by FAITH not by sight.
871711096364822528,2017-06-05 12:51:35,"Without love we don't feel anything.
Without dreams we don't accomplish anything.
Without God we aren't anything."
871698527361093632,2017-06-05 12:01:38,"As churning the milk produces butter, and as twisting the nose produces blood, so stirring up anger produces strife. -Proverbs 30:33"
871685388611596288,2017-06-05 11:09:26,"God is our refuge and strength, a very present help in trouble. -Psalms 46:1"
871672853611130880,2017-06-05 10:19:37,Satan seeks to defeat you by tempting you to trust your own wisdom. TRUST IN GOD.
871659832503402497,2017-06-05 09:27:53,You are a child of God. You're playing small does not serve the world. There is nothing enlightened about shrinking.
871646859521126400,2017-06-05 08:36:20,I put on the Full Armor of God -Ephesians 6:10
871634238361272320,2017-06-05 07:46:11,Love the Lord your God with all your heart &amp; with all your soul &amp; with all your mind. This is the first &amp; greatest commandment. -Matt 22:37
871621371675193345,2017-06-05 06:55:03,Be on your guard; stand firm in the faith; be men of courage; be strong. -1Cor 16:13
871608386177171457,2017-06-05 06:03:27,"What is desired in a man is kindness, &amp; a poor man is better than a liar. -Proverbs 19:22"
871595624017383424,2017-06-05 05:12:44,"If ye love me, keep my commandments. -John 14:15"
871583080947101696,2017-06-05 04:22:54,"The tongue has the power of life and death, and those who love it will eat its fruit. -Proverbs 18:21"
871569838770180096,2017-06-05 03:30:17,"The thief comes only to steal &amp; kill &amp; destroy; I have come that they may have life, &amp; have it to the full. -John 10:10"
871557009677725696,2017-06-05 02:39:18,"You may have weaknesses, but God has strength. You may have sin, but God has grace. You may fail, but God remains faithful!"
871551435565129732,2017-06-05 02:17:09,RT @mother_know: The birth of a mother is a powerful thing. https://t.co/MjxO81oqGD
871544195768614913,2017-06-05 01:48:23,"I pray that the Lord, who gives peace, will always bless you with peace. May the Lord be with all of you too. -Thess 3:16"
871536335080882176,2017-06-05 01:17:09,RT @Saintly_Life: GOD is good. ALL the time.
871531517578801152,2017-06-05 00:58:00,RT @anthemofhope: Hurting? Depressed? Need someone to talk to? Our 24/7 LiveChat is here for you. It’s free and confidential. https://t.co/…
871531419792814080,2017-06-05 00:57:37,Draw near to God and He will draw near to you! -James 4:8
871518701782274048,2017-06-05 00:07:05,"For it is by grace you have been saved, through faith; and this is not from yourselves, it is the gift of God; -Ephesians 2:8"
871505708377927684,2017-06-04 23:15:27,RT @JesusGraces: Show how God is there for you thru your highs and lows with this t-shirt from Elevated Faith -&gt; https://t.co/uvFVZMhY5E ht…
871505692653486081,2017-06-04 23:15:23,"Love is patient, love is kind and is not jealous; love does not brag and is not arrogant -1 Corinthians 13:4"
871493130679455744,2017-06-04 22:25:28,"Do not be anxious about anything, but in everything, by prayer &amp; petition, w/ thanksgiving, present your requests 2 God. -Phil 4:6"
871483931794735105,2017-06-04 21:48:55,RT @Women_Sports: Spring is here and it's about time! Get this shirt here -&gt; https://t.co/x8HgFT5UZx https://t.co/lJ1yvBi8Nl
871480043821813764,2017-06-04 21:33:28,"For I know the plans I have for you, declares the LORD, plans to prosper u &amp; not to harm you, plans to give you hope &amp; a future. -Jer 29:11"
871476569289752580,2017-06-04 21:19:40,RT @JarridWilson: My man @justinbieber is over here preaching at #OneLoveManchester! https://t.co/urHv09HJyh
871475838256107524,2017-06-04 21:16:45,RT @FaithReeI: Mother Chooses Life for Her Baby and Gives Up Her Own. Click&gt;&gt;https://t.co/eiTdg9Re2F https://t.co/x3XnJcoADO
871467281490030593,2017-06-04 20:42:45,Self-restraint &amp; gentle speech are effective against stubborn opposition.
871454469883670529,2017-06-04 19:51:51,Don't procrastinate — there's no time to lose. -Proverbs 6:4
871445659496448000,2017-06-04 19:16:50,RT @The_Gospels: Christ have Mercy. Visit -&gt; https://t.co/1qRf0GTTd3 to secure your subscription https://t.co/gafxtOSHEr
871442017951330305,2017-06-04 19:02:22,"When you are tempted, he will provide a way out so that you can stand up under it. -1Cor 10:13"
871430645523894273,2017-06-04 18:17:10,RT @The_Gospels: The Lord is an avenger -1 Thessalonians 4:6
871428766702161926,2017-06-04 18:09:43,"He who believes in the Son has eternal life; but he who does not obey the Son will not see life, but the wrath of God abides on him. Jn 3:36"
871416148658720772,2017-06-04 17:19:34,"You ask [in prayer] but don't receive it because you ask wrongly, wanting to squander it on pleasure -James 4:3"
871403051227197442,2017-06-04 16:27:31,It was for freedom that Christ set us free; therefore keep standing firm and do not be subject again to a yoke of slavery. -Galatians 5:1
871400358765109248,2017-06-04 16:16:50,RT @FaithReeI: The Design Of This 1930’s Style Village Facility Is Helping Alzheimer’s Patient’s Remember. Click&gt;&gt; https://t.co/tj7fQqAxyA…
871390221929263105,2017-06-04 15:36:33,"God's will is not an itinerary, but an attitude.  -Andrew Dhuse"
871377510004654080,2017-06-04 14:46:02,"If you can believe, all things are possible to him who believeth. -Mark 9:23"
871373533481402368,2017-06-04 14:30:14,RT @Quote_Soup: RT if you have similar day. -&gt; get it here: https://t.co/C9pf1Qva6j https://t.co/kJPefBuZS0
871364642563641346,2017-06-04 13:54:54,Some say: God loves us if we change. The Gospel says: God's love CHANGES us.
871351771943362560,2017-06-04 13:03:46,I know that God will give you whatever you ask of him. -John 11.22.
871340030110953473,2017-06-04 12:17:06,RT @llovmydog: Amazing blue eyes!  https://t.co/eg4wt0qvJw
871338836701450241,2017-06-04 12:12:22,Those who mock the poor insult their Maker; those who rejoice at the misfortune of others will be punished. -Proverbs 17:5
871326056355180544,2017-06-04 11:21:34,"He who conceals his hatred has lying lips, and whoever spreads slander is a fool. -Proverbs 10:18"
871313328248946689,2017-06-04 10:31:00,"Blessed are the peacemakers, for they will be called children of God. -Matthew 5.9"
871300506999762944,2017-06-04 09:40:03,"A man can no more diminish God's glory by refusing 2 worship him than a lunatic can put out the sun by scribbling the word, 'darkness'"
871287515222863872,2017-06-04 08:48:26,I can't believe that God put us on this earth to be ordinary. -Lou Holtz
871279159926018048,2017-06-04 08:15:13,RT @TabithaKhaye: Doctor Says This Baby Is A Real Miracle! Mom Says He Was Touched By The Hand Of Grace. click&gt;&gt; https://t.co/TfnNZ2OvYh ht…
871274875452874752,2017-06-04 07:58:12,"He that believeth on me, as the scripture hath said, out of his belly shall flow rivers of living water. -John 7:38"
871262119907524608,2017-06-04 07:07:31,Anyone who does not do what is right is not a child of God; nor is anyone who does not love his brother. -1John 3:10
871249156815409152,2017-06-04 06:16:00,"Hatred stirs up dissension, but love covers over all wrongs. -Proverbs 10:12"
871236141202198528,2017-06-04 05:24:17,Pray that we may be given a hunger &amp; burning desire to fellowship more closely with Jesus
871223449326432257,2017-06-04 04:33:51,"I love you, O LORD, my strength. -Psalm 18:1"
871210643323572224,2017-06-04 03:42:58,Everyone who calls on the name of the Lord will be saved. -Romans 10:13
871197752285421568,2017-06-04 02:51:44,"If we confess our sins, he is faithful &amp; just &amp; will forgive us ur sins &amp; purify us from all unrighteousness. -1John 1:9"
871189023523577856,2017-06-04 02:17:03,RT @llovmycat: Kitty banana! https://t.co/2nlpXiMLCr
871185176986087424,2017-06-04 02:01:46,"And the crooked shall be made straight, &amp; the rough ways shall be made smooth. -Luke 3.5"
871171967419916290,2017-06-04 01:09:17,"If you love Me, you will keep My commandments. -John 14:15"
871159145398927361,2017-06-04 00:18:20,"A patient man has great understanding, but a quick-tempered man displays folly. -Prov 14:25"
871146316377845768,2017-06-03 23:27:21,"We know that in all things God works for the good of those who love him, who have been called according to his purpose. -Romans 8:28"
871133535335305216,2017-06-03 22:36:34,"Apply your heart to instruction, and your ears to words of knowledge. -Proverbs 23:12"
871126078047301633,2017-06-03 22:06:56,RT @JarridWilson: Nobody is too far gone for the reach of Jesus' grace. https://t.co/gQA5enRpk8
871120704900673538,2017-06-03 21:45:35,Trust in the LORD with all your heart &amp; lean not on your own understanding. -Prov 3:5
871107874474348545,2017-06-03 20:54:36,Jesus Christ was delivered over to death for our sins and was raised to life for our justification. -Romans 4:25
871095028944441345,2017-06-03 20:03:33,"They said, ""Believe in the Lord Jesus, and you will be saved..."" -Acts 16:31"
871083251317825539,2017-06-03 19:16:45,RT @The_Gospels: Words to LIVE by. Visit -&gt; https://t.co/1qRf0GTTd3 to sign-up for our daily inspirational emails. https://t.co/th7Ck0NjSw
871082239194529792,2017-06-03 19:12:44,"No one has ever seen God; but if we love one another, God lives in us and his love is made complete in us. -1John 4:12"
871069428833804290,2017-06-03 18:21:50,The righteousness that comes from God &amp; is by faith. -Phil 3:9
871056563389247489,2017-06-03 17:30:42,Pray for those who threaten you. -Luke 6:28
871043685068222464,2017-06-03 16:39:32,"You're not a failure until you stop trying. If you have no other testimony you have this one: ""I'm still here."""
871037957611958272,2017-06-03 16:16:46,RT @FaithReeI: After Sneaking Away From Their Hospital Beds You Won’t Believe The Mischief These Kids Do. Click&gt;&gt;https://t.co/gxxN4XMzpS ht…
871030884144746496,2017-06-03 15:48:40,Rejoice in the Lord always. I will say it again: Rejoice! -Philippians 4:4
871018098496851968,2017-06-03 14:57:52,One of the best gifts we can give ourselves is time alone with God.
871005321367629824,2017-06-03 14:07:05,Love the Lord your God with all your heart &amp; with all your soul &amp; w/ all your mind. This is the 1st &amp; greatest commandment. -Matthew 22:37
871001174488604672,2017-06-03 13:50:37,RT @PrayInFaith: Be Grateful. Show your gratitude. -&gt; https://t.co/l5uwDQUZex https://t.co/ruCkB7m984
870992592611180545,2017-06-03 13:16:30,"In your anger do not sin. Do not let the sun go down while you are still angry, &amp; do not give the devil a foothold. -Eph 4:26"
870979619465375744,2017-06-03 12:24:57,"If we confess our sins, he is faithful and just and will forgive us our sins and purify us from all unrighteousness. -1John 1:9"
870977705965236224,2017-06-03 12:17:21,RT @mother_know: Motherhood rocks! https://t.co/MNXD48vVQU
870966748824076289,2017-06-03 11:33:49,"Look, I am coming soon! My reward is with me, and I will give to everyone according to what they have done. -Revelation 22:12"
870953845580582912,2017-06-03 10:42:32,I know that God will give you whatever you ask of him. -John 11.22.
870941096578363392,2017-06-03 09:51:53,Love the LORD your God with all your heart and with all your soul and with all your strength. -Deuteronomy 6:5
870928476873871360,2017-06-03 09:01:44,"If you love me, obey my commandments. -John 14:15"
870915425604964352,2017-06-03 08:09:52,"A man's own folly ruins his life, yet his heart rages against the LORD. -Proverbs 19:3"
870902590107766784,2017-06-03 07:18:52,"But seek first his kingdom &amp; his righteousness, and all these things will be given to you as well. -Matthew 6:33"
870889712751448065,2017-06-03 06:27:42,My soul finds rest in God alone; my salvation comes from him. -Psalm 62:1
870876804717969408,2017-06-03 05:36:25,"Do not conform any longer to the pattern of this world, but be transformed by the renewing of your mind. -Romans 12:2"
870864087303024640,2017-06-03 04:45:52,"The thief comes only to steal &amp; kill &amp; destroy; I have come that they may have life, &amp; have it to the full. -John 10:10"
870851186538283012,2017-06-03 03:54:37,"Friends come and go, but Jesus comes and stays."
870838721695952897,2017-06-03 03:05:05,Speak up for those who cannot speak for themselves; ensure justice for those being crushed. -Proverbs 31:8
870826672320385024,2017-06-03 02:17:12,RT @TabithaKhaye: This Dad &amp; Baby Out Flexing Each Other Is Awesomely Cute! Click&gt;&gt;https://t.co/KlUVPSsNTg https://t.co/QNZVrI8S4F
870825455506657280,2017-06-03 02:12:22,Surely God is my salvation; I will trust and not be afraid. -Isaiah 12:2
870812651491917825,2017-06-03 01:21:29,"The life I live in the body, I live by faith in the Son of God, who loved me &amp; gave himself for me. -Gal 2:20"
870811572020662273,2017-06-03 01:17:12,"RT @Scripture_Truth: By wisdom a house is built, &amp; through understanding it is established; -Proverbs 24:3"
870799860697636866,2017-06-03 00:30:40,"By wisdom a house is built, &amp; through understanding it is established; -Proverbs 24:3"
870786969864998912,2017-06-02 23:39:26,Greater love has no one than this: to lay down one's life for one's friends. -John 15:13
870774185001459712,2017-06-02 22:48:38,"He that believeth on me, as the scripture hath said, out of his belly shall flow rivers of living water. -John 7:38"
870761332953546752,2017-06-02 21:57:34,"Commit to the LORD whatever you do, &amp; your plans will succeed. -Prov 16:3"
870751076450004994,2017-06-02 21:16:49,RT @FaithReeI: Watch This 7 Yr Old Have A Showdown With His Tap Dance Teacher It’ll Make Your Day! Click&gt;&gt; https://t.co/jqFlM2lA75 https://…
870748610702569473,2017-06-02 21:07:01,Never let people's negative thoughts about you hinder you from accomplishing what God put in your heart. Dare to dream and dare to live it.
870735712848629761,2017-06-02 20:15:46,"You are wonderful, LORD, &amp; you deserve all praise, because you are much greater than anyone can understand. -Psalm 145:3"
870722850449227776,2017-06-02 19:24:39,There's no fear in love. Instead complete love drives out fear - 1John 4:18
870720852555444224,2017-06-02 19:16:43,RT @The_Gospels: Searching for more The Gospel Daily? Visit -&gt; https://t.co/1qRf0GTTd3 https://t.co/ZEN6hpoLgB
870710291188727808,2017-06-02 18:34:45,Grace is God doing for us what we could never do and what we will never deserve.
870705837127249920,2017-06-02 18:17:03,"RT @Saintly_Life: Life is not about waiting for the storm to pass, It is about learning to dance in the rain."
870697308244946944,2017-06-02 17:43:09,I am with you always -Matthew 28:20
870696417282580480,2017-06-02 17:39:37,RT @anthemofhope: Hate destroys. Love builds.
870684279835025408,2017-06-02 16:51:23,"We know that in all things God works for the good of those who love him, who have been called according to his purpose. -Rom 8:28"
870682561562816512,2017-06-02 16:44:33,RT @JarridWilson: My man... https://t.co/xur6kT9BEh
870675556832096256,2017-06-02 16:16:43,"RT @FaithReeI: Wife Surprises Husband In Photo Booth With Pregnancy News,  Must See! Click&gt;&gt;https://t.co/zgv03ilx3U https://t.co/HrUWP2uFpa"
870671683790798849,2017-06-02 16:01:20,"I am the Alpha and the Omega, says the Lord God, ""who is &amp; who was &amp; who is to come, the Almighty."" -Revelation 1:8"
870658722242101249,2017-06-02 15:09:50,"Knock, &amp; the door will be opened. -Luke 11.9"
870645750140633088,2017-06-02 14:18:17,There is no fear in love; but perfect love casteth out fear. -1John 4:18
870644559625236481,2017-06-02 14:13:33,RT @LifeLimits: Are or Aren't YOU -&gt; https://t.co/29cDlKCXzx https://t.co/68RjSoJReb
870632951540854784,2017-06-02 13:27:25,Praise the God &amp; Father of our Lord Jesus Christ! He is the Father who is compassionate and the God who gives comfort. - 2 Corinthians 1:3
870620100101066752,2017-06-02 12:36:21,"Many are the woes of the wicked, but the LORD's unfailing love surrounds the man who trusts in him. -Psalm 32:10"
870615229440380928,2017-06-02 12:17:00,RT @llovmydog: Naughty dog!  https://t.co/MvZgmQIAwr
870607375996260354,2017-06-02 11:45:48,You can't change what has already happened so choose to look ahead instead of behind you.
870594420583915520,2017-06-02 10:54:19,Submit therefore to God. Resist the devil and he will flee from you. -James 4:7
870581630636871681,2017-06-02 10:03:30,"Be transformed by the renewing of your minds, so that you may discern what is good &amp; acceptable &amp; perfect. -Rom 12.2"
870568876249108480,2017-06-02 09:12:49,We know that all things work together for good for those who love God. -Romans 8:28
870556077288456192,2017-06-02 08:21:57,"Do not seek the world.
Seek Peace
Seek Truth
Seek Love
Seek Christ"
870543409706086400,2017-06-02 07:31:37,"For God did not send his Son into the world to condemn the world, but to save the world through him. -John 3:17"
870530315508264961,2017-06-02 06:39:35,"Be transformed by the renewing of your minds, so that you may discern what is good &amp; acceptable &amp; perfect. -Rom 12:2"
870517841199419393,2017-06-02 05:50:01,I'm a Christian. I'm not perfect. Just because I mess up sometimes doesn't mean I'm fake. There's no such thing as a perfect Christian.
870504795810832385,2017-06-02 04:58:11,"Sometimes, I just sit back and realize how blessed I am. God is great. I have amazing people in my life. I shouldn't complain. Praise Him"
870491776376741889,2017-06-02 04:06:27,"I have been crucified with Christ &amp; I no longer live, but Christ lives in me. -Gal 2:20"
870478971351293952,2017-06-02 03:15:34,God never leads us where He cannot keep us. His grace is always sufficient for us in any and every circumstance of life.
870466169064632320,2017-06-02 02:24:41,"Not only so, but we also glory in our sufferings, because we know that suffering produces perseverance. -Romans 5:3"
870464260689846275,2017-06-02 02:17:06,RT @llovmydog: So cute captions this picture. https://t.co/L1sP17Pvoh
870453547233681408,2017-06-02 01:34:32,"If we confess our sins, he is faithful and just and will forgive us our sins and purify us from all unrighteousness. -1John 1:9"
870440422002307072,2017-06-02 00:42:23,"He holds victory in store for the upright, he is a shield to those whose walk is blameless. -Proverbs 2:7"
870427684584771584,2017-06-01 23:51:46,"A new commandment I give to you, that you love one another, even as I have loved you, that you also love one another. -John 13:34"
870414972689494016,2017-06-01 23:01:15,"The peace of God, which transcends all understanding, will guard your hearts &amp; your minds in Christ Jesus. -Phil 4:7"
870401934968205314,2017-06-01 22:09:27,"If your enemy is hungry, give him food to eat; if he is thirsty, give him water to drink. -Proverbs 25:21"
870389068420571136,2017-06-01 21:18:19,"We know and rely on the love God has for us. God is love. Whoever lives in love lives in God, &amp; God in him. -1John 4:16"
870388651334782977,2017-06-01 21:16:40,RT @FaithReeI: Orangutan Spots Baby In A Crowd And Slowly Closes In To Give It Kisses.                                  Click&gt;&gt;&gt;https://t.c…
870376495260348416,2017-06-01 20:28:21,One who trusts in the Lord is secure. -Proverbs 29.25
870363450320572416,2017-06-01 19:36:31,Make decisions based on what you know rather than what you feel.
870358477817991168,2017-06-01 19:16:46,RT @The_Gospels: Today's message was FOR YOU! Visit -&gt; https://t.co/1qRf0GTTd3 &amp; signup for our daily emails. https://t.co/YXNq7KCmPA
870350876988276736,2017-06-01 18:46:34,"Keep your heart with all vigilance, for from it flow the springs of life. -Proverbs 4.23"
870337986327719937,2017-06-01 17:55:20,"And thou shalt love the Lord thy God with all thine heart, and with all thy soul, &amp; with all thy might. -Deuteronomy 6:5"
870324967803686912,2017-06-01 17:03:36,"If we live by the Spirit, let us also be guided by the Spirit. -Gala 5.25"
870312291589402624,2017-06-01 16:13:14,"A wise man is full of strength, and a man of knowledge enhances his might. -Proverbs 24:5"
870299294426963969,2017-06-01 15:21:35,"When life is tough, PRAY. 
When life is great, PRAY."
870286579687976961,2017-06-01 14:31:04,The Spirit gives life; the flesh counts for nothing. The words I have spoken to you; they are full of the Spirit &amp; life. -John 6:63
870273665845399554,2017-06-01 13:39:45,"Truly I tell you, whatever you did for one of the least of these brothers &amp; sisters of mine, you did for me. -Matthew 25:40"
870260950112374784,2017-06-01 12:49:13,You never really know yourself until you see yourself under pressure.
870252847681740800,2017-06-01 12:17:02,RT @amotherjoy: Look at face. https://t.co/GCQsxgnx4C
870247886285676544,2017-06-01 11:57:19,"Be content with what you have, because God has said, ""Never will I leave you; never will I forsake you."" -Hebrews 13:5"
870243436682780672,2017-06-01 11:39:38,RT @LifeLimits: Never Travel Alone. RT if you want this shirt. Get it here - https://t.co/LDlUsGweDw https://t.co/qO2l9Xyvr4
870235100365168640,2017-06-01 11:06:30,"O LORD, be gracious to us; we long for you. Be our strength every morning, our salvation in time of distress. -Isaiah 33:2"
870222247566430208,2017-06-01 10:15:26,God has a blessing with your name on it.
870209645247442944,2017-06-01 09:25:21,"If anyone is in Christ, he is a new creation: the old has passed away, behold, the new has come. -2Corinthians 5:17"
870196774165762048,2017-06-01 08:34:13,"For I know the plans I have for you, declares the LORD, plans to prosper u &amp; not to harm you, plans to give you hope &amp; a future. -Jer 29:11"
870183713442852865,2017-06-01 07:42:19,"I sought the Lord, &amp; He answered me, &amp; delivered me from all my fears. Look to Him &amp; be radiant. -Psalm 34:4-5"
870170899416219648,2017-06-01 06:51:24,"Let us always meet each other with a smile, for the smile is the beginning of love. - Mother Teresa"
870158255691108353,2017-06-01 06:01:09,"Commit to the LORD whatever you do, &amp; your plans will succeed. -Proverbs 16:3"
870145313193021444,2017-06-01 05:09:43,The words that I say to you I do not speak on my own; but the Father who dwells in me does his works. -John 14.10
870132385785970688,2017-06-01 04:18:21,"Protect me, God, when I take refuge in you - Psalm 16:1"
870119554801946624,2017-06-01 03:27:22,Whatever God calls you to do He equips you to do as well.
870106702565257216,2017-06-01 02:36:18,I have faith that God is living out a divine plan through me. Have faith in God. -Mark 11:22
