id,created_at,text
864344203572031494,2017-05-16 04:58:11,"And He said... ""your faith has made you well; go in peace."" -Luke 8:48"
864331547956129792,2017-05-16 04:07:54,Love your neighbor as yourself. -Matthew 22:37
864318334933897217,2017-05-16 03:15:23,Make up your mind that you're not going to quit until you see the fruit of what God has placed within you.
864305474400858113,2017-05-16 02:24:17,God has a more awesome plan for your life than you could ever imagine simply because He loves you!
864303632191193088,2017-05-16 02:16:58,"RT @llovmycat: Awww, a cold little kitty. https://t.co/AsTmW53I37"
864292737121734656,2017-05-16 01:33:40,"GOD IS THE REASON WHY:
- In pain, I smile
- In confusion, I understand.
- In betrayal, I trust.
- In fear, I push forward."
864288527751761920,2017-05-16 01:16:57,"RT @FaithReeI: Serve the Lord with fear, &amp; rejoice with trembling. -Psalm 2:11"
864280008285720576,2017-05-16 00:43:06,"God is the best part of my life. Without Him, I can't imagine where I'd be."
864267055129919488,2017-05-15 23:51:37,"Blessed are the merciful, for they will be shown mercy. -Matthew 5:7"
864254474050830336,2017-05-15 23:01:38,"For everyone who asks receives, and he who seeks finds, and to him who knocks it will be opened. -Matthew 7:8"
864241366431354882,2017-05-15 22:09:33,"God has never stopped being good, we've just stop being grateful."
864238737944870912,2017-05-15 21:59:06,RT @Women_Of_Christ: GOD made us BFFs… -&gt; https://t.co/pRb6IniI1A https://t.co/EBP67n7noG
864228496918417409,2017-05-15 21:18:24,People should always pray and not give up - Luke 18:1
864216035687370752,2017-05-15 20:28:53,"You can decide to trust God, or you can decide to be miserable."
864202950834630658,2017-05-15 19:36:54,"Decide today that you won't give up on your dreams and desires. Keep pressing forward, believing that you are anointed and empowered."
864197836224823296,2017-05-15 19:16:34,RT @The_Gospels: Treat EACH &amp; EVERY day like a new beginning. -&gt; Visit https://t.co/1qRf0GTTd3 &amp; signup for our inspirational emails https:…
864190133939167232,2017-05-15 18:45:58,"Jesus died for you, knowing you might never love Him back. THAT is true love."
864177244452859904,2017-05-15 17:54:45,"I love you, O LORD, my strength. -Psalm 18:1"
864176491155906560,2017-05-15 17:51:45,RT @TabithaKhaye: Grandma Teaches Adorable 8 Wk Old Baby Sign Language. Click&gt;&gt;https://t.co/y1Mj81l1yR https://t.co/5enLtFfPJt
864164351019823104,2017-05-15 17:03:31,"Despite their desires, the lazy will come to ruin, for their hands refuse to work. -Proverbs 21:25"
864152583602130944,2017-05-15 16:16:45,RT @FaithReeI: It’s Viral ! Home Alone! See What Happens When Mom Isn’t There. Click&gt;&gt;https://t.co/BzAlMkVmWx https://t.co/fKd0KgiHz5
864151454063484931,2017-05-15 16:12:16,You have been saved as a favor through faith. This doesn't come from yourselves. It's God's gift - Ephesians 2:8
864138639919521792,2017-05-15 15:21:21,"GOD LOVES YOU!
- He will be there for you.
- He will make a way for you.
- He will wipe away your tears.
- He will be your best friend."
864126154818637824,2017-05-15 14:31:44,"You will turn back to me &amp; ask for help, &amp; I will answer your prayers - Jer 29:12"
864113039838150656,2017-05-15 13:39:37,The path of lazy people is overgrown with briers; the diligent walk down a smooth road. -Proverbs 15:19
864100220442988544,2017-05-15 12:48:41,God will never lead you wrong.
864090380316413953,2017-05-15 12:09:35,RT @Sports_Greats: RT - If YOU are the HAPPY CAMPER! -&gt; https://t.co/V9UiKuzmvv https://t.co/IATo1hCEJA
864087477119799296,2017-05-15 11:58:03,"Salvation is found in no one else, for there is no other name given under heaven by which we must be saved. -Acts 4:12"
864074523490045952,2017-05-15 11:06:34,"God wants your 1st relationship to be with Him. Then one another, then outreach to the  world. -Eph 4:11-13"
864061702710669313,2017-05-15 10:15:38,Trust the LORD &amp; his mighty power. -Psalm 105:4
864048981038571520,2017-05-15 09:25:04,"Pride goes before destruction, a haughty spirit before a fall. -Proverbs 16:18"
864035998749126656,2017-05-15 08:33:29,"Hold your head up high, and know God is in control he has a perfect plan for your life."
864023129957556224,2017-05-15 07:42:21,"Keep your mind going in the right direction, and your life will catch up with it."
864010339788222466,2017-05-15 06:51:32,My command is this: Love each other as I have loved you. -John 15:12
863997704766181376,2017-05-15 06:01:19,"In your anger do not sin. Do not let the sun go down while you are still angry, &amp; do not give the devil a foothold. -Eph 4:26"
863984683788513280,2017-05-15 05:09:35,"Train up a child in the way he should go: and when he is old, he will not depart from it. -Proverbs 22:6"
863971993854652416,2017-05-15 04:19:09,"God demonstrates his own love for us in this: While we were still sinners, Christ died for us. -Rom 5:8"
863959017495953408,2017-05-15 03:27:36,"Pride only breeds quarrels, but wisdom is found in those who take advice. -Proverbs 13:10"
863946229243412480,2017-05-15 02:36:47,"The Lord will fulfill his purpose for me; your steadfast love, O Lord, endures forever. -Psalm 138.8"
863941241960091648,2017-05-15 02:16:57,"RT @TabithaKhaye: Things that you enjoy are never a waste of time, everything else is suspect. https://t.co/Am7uLTf7hb"
863933407914598400,2017-05-15 01:45:50,Never let loyalty and kindness leave you! Tie them around your neck as a reminder. Write them deep within your heart. -Proverbs 3:3
863926162329874432,2017-05-15 01:17:02,RT @FwJesus: Love and value yourself. You are God's creation and He paid a dear price for you to be alive today.
863920484404129792,2017-05-15 00:54:29,"For the Spirit God gave us does not make us timid, but gives us power, love and self-discipline. -2Timothy 1:7"
863913949980446723,2017-05-15 00:28:31,RT @Inspire_Us: You know you have a friend who absolutely needs this! -&gt; https://t.co/NfRfl1sL5E https://t.co/4G3ElVDPdy
863907877521641474,2017-05-15 00:04:23,"Praise the LORD, O my soul; all my inmost being, praise his holy name. -Psalm 103:1"
863894830497366016,2017-05-14 23:12:32,Praise God even when you dont understand what He's doing.
863882010753945602,2017-05-14 22:21:36,"If you can't control what you think, you will not be able to control what you do."
863869439510544387,2017-05-14 21:31:38,Jesus Gives Hope.
863865652607672320,2017-05-14 21:16:36,RT @FaithReeI: This Tribute To Mother’s Proves It’s The World’s Best &amp; Hardest Job And Here’s Why!     Click&gt;-&gt; https://t.co/WNmoFNiOdu htt…
863856403055869952,2017-05-14 20:39:50,"Frustration, complication, and misery are available in abundance, but so is God's grace."
863843461996400640,2017-05-14 19:48:25,"Walk boldly through the doors God opens for you, and don't become discouraged when He closes one."
863835444173295618,2017-05-14 19:16:33,RT @The_Gospels: Let's begin today with a PRAYER. Visit -&gt; https://t.co/1qRf0GTTd3 &amp; signup for our daily emails. https://t.co/yZedoBfYYl
863830775564828674,2017-05-14 18:58:00,"When you take time with God and listen to His voice, He renews your strength and enables you to handle life."
863820436005670914,2017-05-14 18:16:55,"RT @The_Gospels: Do not conform any longer to the pattern of this world, but be transformed by the renewing of your mind. -Rom 12:2"
863818188634697728,2017-05-14 18:07:59,For God alone my soul waits in silence. -Psalm 62:1
863805035163115520,2017-05-14 17:15:43,And nothing will be impossible for you. -Matthew 17.20
863792155374088192,2017-05-14 16:24:32,"For I am with you, &amp; no one is going to attack &amp; harm you, because I have many people in this city. -Acts 18:10"
863779643928825857,2017-05-14 15:34:50,God + u = all u need
863773676075966465,2017-05-14 15:11:07,RT @JesusGraces: Happy Mother's Day https://t.co/zTpmpzQ5HG
863772387141181440,2017-05-14 15:05:59,RT @Inspire_Us: Can you find a better morning combination? https://t.co/NhV2rtjcS8 https://t.co/oI1RZTkzQl
863766753268162560,2017-05-14 14:43:36,"One night the Lord spoke to Paul in a vision: ""Do not be afraid; keep on speaking, do not be silent."" -Acts 18:9"
863753614778650628,2017-05-14 13:51:24,I am a Christian. That does not mean I am perfect. Just forgiven.
863741300478181376,2017-05-14 13:02:28,"God has a bright future in store for you!
 - Keep standing
 - Keep believing
 - Keep hoping"
863728137686929408,2017-05-14 12:10:09,Be on your guard; stand firm in the faith; be men of courage; be strong. -1Corinthians 16:13
863715377725022208,2017-05-14 11:19:27,"Create in me a clean heart, O God. -Psalm 51.10"
863702336333647872,2017-05-14 10:27:38,Love is not a feeling we have; it's a decision to treat people the way Jesus would treat them.
863689444481785856,2017-05-14 09:36:24,In God we will be strong - Psalm 60:12
863676807781863424,2017-05-14 08:46:11,"I pray to you, my protector. -Psalm 57:2"
863663761441390594,2017-05-14 07:54:21,"A friend loves at all times, &amp; a brother is born for adversity. - Prov 17:17"
863651099617763328,2017-05-14 07:04:02,"You will be secure, because there is hope; you will look about you &amp; take your rest in safety. -Job 11:18"
863638163427909632,2017-05-14 06:12:38,"Submit yourselves therefore to God. Resist the devil, and he will flee from you. -James 4:7"
863625572102156288,2017-05-14 05:22:36,Humility and the fear of the LORD bring wealth and honor and life. -Proverbs 22:4
863612605721718792,2017-05-14 04:31:05,"Whatever is true, whatever is noble, right, pure, lovely, admirable, excellent or praiseworthy - think of such things. -Phil 4:8"
863599618185211904,2017-05-14 03:39:28,Every word of God is pure; He is a shield unto them that put their trust in him. -Proverbs 30:5
863586842494590976,2017-05-14 02:48:42,"And He said. ""Your faith has made you well; go in peace."" -Luke 8:48"
863578908192632832,2017-05-14 02:17:10,RT @mother_know: Adulting is not for wimps :) https://t.co/3qkZFfIWDh
863574007878221827,2017-05-14 01:57:42,For all have sinned and fall short of the glory of God. -Romans 3:23
863562130217472000,2017-05-14 01:10:30,RT @JarridWilson: God isn't done with you just because you messed up. His grace is available. A second chance is waiting. He's got plans fo…
863561134540034048,2017-05-14 01:06:33,Anyone who does not do what is right is not a child of God; nor is anyone who does not love his brother. -1John 3:10
863548323508219907,2017-05-14 00:15:38,"God is spirit, and his worshipers must worship in the Spirit and in truth. -John 4:24"
863535442913878016,2017-05-13 23:24:27,The God who made the world &amp; everything in it is the Lord of heaven &amp; earth &amp; does not live in temples built by hands. -Acts 17:24
863522607404126208,2017-05-13 22:33:27,Disappointments were not meant to destroy you. They were meant to strengthen you &amp; give you fortitude to accomplish your God-given destiny.
863509870607257600,2017-05-13 21:42:51,Never underestimate the power of a prayer. One small prayer can change your life dramatically.
863503283943604224,2017-05-13 21:16:40,RT @FaithReeI: Watch This 7 Yr Old Have A Showdown With His Tap Dance Teacher It’ll Make Your Day! Click&gt;&gt; https://t.co/jqFlM2DbvF https://…
863496927488421890,2017-05-13 20:51:25,"Don't worry if you're single. God is looking at you right now, saying, ""I'm saving this one for someone special"""
863484406056595456,2017-05-13 20:01:39,What God intended for you goes far beyond anything you can imagine. Never lose hope and hang on to God's hand.
863473171093233665,2017-05-13 19:17:01,RT @The_Gospels: Words to LIVE by. Visit -&gt; https://t.co/1qRf0GTTd3 to sign-up for our daily inspirational emails. https://t.co/b7SfrCSsjP
863471382994309120,2017-05-13 19:09:54,"Always keep your head up, because if it's down you won't be able to see the blessings that have been placed in your life."
863458533618184194,2017-05-13 18:18:51,I have faith that God is living out a divine plan through me. Have faith in God. -Mark 11:22
863458103903367169,2017-05-13 18:17:08,RT @daiIyscripture: https://t.co/u5EP4bhIHx
863445718719246336,2017-05-13 17:27:56,"Many books can INFORM you, but the Bible can TRANSFORM you."
863432738652770304,2017-05-13 16:36:21,"If you do good to those who are good to you, what credit is that to you? Even ""sinners"" do that. -Luke 6:33"
863419989327581184,2017-05-13 15:45:41,It is your Father's good pleasure to give you the kingdom. -Luke 12.32
863407194926178305,2017-05-13 14:54:51,"Happiness is not based on your circumstances, but on a decision you make."
863394629680541698,2017-05-13 14:04:55,Love your enemies. Do good to those who hate you. Speak well of those who curse you. -Luke 6:27-28
863381494559059968,2017-05-13 13:12:43,"7 days without prayer makes one ""weak"" :)"
863368837496016896,2017-05-13 12:22:26,Trust the LORD &amp; his mighty power. -Psalm 105:4
863367515522650114,2017-05-13 12:17:10,RT @llovmycat: Cutest kitten ever! https://t.co/rAhOTGwEgz
863355823820603392,2017-05-13 11:30:43,Trust in Him!
863343011702460417,2017-05-13 10:39:48,Now faith is being sure of what we hope for &amp; certain of what we do not see. -Hebrews 11:1
863330059775553536,2017-05-13 09:48:20,Let go of the disappointments and setbacks in your life and hang on to the promises of God for your future.
863317367866228736,2017-05-13 08:57:54,Fight the good fight of the faith. Take hold of the eternal life to which you were called. -1Tim 6:12
863304383060221953,2017-05-13 08:06:18,It is you who made the heavens and the earth by your great power. Nothing is too hard for you. -Jeremiah 32:17
863291625006661632,2017-05-13 07:15:37,Each person you meet is Jesus in disguise. -Mother Teresa
863278897877704704,2017-05-13 06:25:02,"Above all, love each other deeply, because love covers over a multitude of sins. -1Peter 4:8"
863266004549423104,2017-05-13 05:33:48,The Lord is… at my right hand so that I won't be shaken - Acts 2:25
863253066941952000,2017-05-13 04:42:24,I tell you not to worry about your life. -Matthew 6:25
863240238432481280,2017-05-13 03:51:25,"But even when I am afraid, I keep on trusting you. -Psalm 56:3"
863227608183574528,2017-05-13 03:01:14,Delight yourself in the LORD &amp; he'll give you the desires of your heart. -Psalm 37:4
863214646244913156,2017-05-13 02:09:44,"In your relationships with one another, have the same attitude of mind Christ Jesus had: -Philippians 2:5"
863201740589584384,2017-05-13 01:18:27,God remains in us and his love in us is made complete. -1John 4:12
863201396069474304,2017-05-13 01:17:04,"RT @AthIetesForGod: Don't be a spectator, don't let life pass you by. -Lou Holtz"
863189088383504384,2017-05-13 00:28:10,I consider that our present sufferings are not worth comparing with the glory that will be revealed in us. -Romans 8:18
863176181415383041,2017-05-12 23:36:53,"Jesus said, ""For mortals it is impossible, but for God all things are possible. -Mat 19:26"
863163450247262208,2017-05-12 22:46:17,When I think of all the stuff I've been through I have confidence I can get through this. I trust that God will take care of me.
863150368796155905,2017-05-12 21:54:19,With God all things are possible. -Matthew 19:26
863140919956168704,2017-05-12 21:16:46,RT @FaithReeI: Gone Viral! This Popping Hip Hop Dance Is Mesmerizing!  Click&gt;&gt;https://t.co/hUvDAzwArZ https://t.co/tIhU0nhb8N
863137729999249411,2017-05-12 21:04:05,"Jesus answered, ""I am the way &amp; the truth &amp; the life. No one comes to the Father except through me. -John 14:6"
863124764004679681,2017-05-12 20:12:34,Respect those… who caution you -1 Thessalonians 5:12
863111957565628420,2017-05-12 19:21:41,"I fall asleep in peace the moment I lie down because you alone, O LORD, enable me to live securely. -Psalm 4.8"
863110724633190400,2017-05-12 19:16:47,RT @The_Gospels: Looking for some INSPIRATION? Visit -&gt; https://t.co/1qRf0GTTd3 and sign up for our daily emails. https://t.co/EE70Rax0CX
863099239370547200,2017-05-12 18:31:08,"Before his downfall a man's heart is proud, but humility comes before honor. -Proverbs 18:12"
863095700699185153,2017-05-12 18:17:05,RT @JesusGraces: Take your pain and turn it into something great. Put your energy towards bettering your life and starting something new.
863086395774169088,2017-05-12 17:40:06,"He was crushed for our iniquities; the punishment that brought us peace was upon him, &amp; by his wounds we are healed. -Isa 53:5"
863073356844855296,2017-05-12 16:48:18,Never lose faith. God loves you too much to let you down.
863065410333233153,2017-05-12 16:16:43,"RT @FaithReeI: Cute Baby Koala, Imogen Climbs Up People To Get Hugs &amp; Steals Hearts! Click&gt;&gt;https://t.co/sbGYcSMHUb https://t.co/fFQfarAkkc"
863060643443769345,2017-05-12 15:57:46,"Cast all your anxiety on him, because he cares for you. -1Peter 5.7"
863047769384247296,2017-05-12 15:06:37,"Unless you change and become like little children, you will never enter the kingdom of heaven. -Matthew 18:3"
863034978371854336,2017-05-12 14:15:47,Great peace have those who love your law; nothing can make them stumble. -Psalm 119.165
863022019700551682,2017-05-12 13:24:18,God Is There Even When You're At Your Lowest. He's Working Things Out Even When You Don't Know It.
863009236296585216,2017-05-12 12:33:30,"The Lord will be a refuge for the oppressed, a refuge for times of trouble - Psalm 9:9"
863005166408171520,2017-05-12 12:17:20,RT @amotherjoy: Adorable! https://t.co/qPO4aw4UKm
862996361163272193,2017-05-12 11:42:20,The Lord's word is pure - Psalm 18:30.
862989440901419008,2017-05-12 11:14:50,RT @Epic_Women: From the Bottom to the Top YOU are PERFECT -&gt; https://t.co/kMbl28e6O2 https://t.co/UPJ7fcxbXt
862983580171075584,2017-05-12 10:51:33,A positive attitude gives you power over your circumstances instead of your circumstances having power over you.
862970905739264001,2017-05-12 10:01:11,"Be strong &amp; take heart, all you who hope in the LORD. Psalm. 31:24"
862957958262554624,2017-05-12 09:09:44,Make every effort to live in peace with everyone and to be holy; without holiness no one will see the Lord. -Hebrews 12:14
862945160354820096,2017-05-12 08:18:53,Wishing will NEVER be a substitute for prayer.
862940808688930816,2017-05-12 08:01:36,RT @Inspire_Us: Baby Fennec Foxes Take Their First Bubble Bath. This Is A Cuteness Overload! click&gt;&gt;https://t.co/cH8UdjKbyS https://t.co/Gv…
862932307442847745,2017-05-12 07:27:49,"Praise be to the God and Father of our Lord Jesus Christ, the Father of compassion &amp; the God of all comfort. -2Cor 1:3"
862919474118307841,2017-05-12 06:36:49,"If we say that we have no sin, we are deceiving ourselves and the truth is not in us. -1 John 1:8"
862906931815567361,2017-05-12 05:46:59,"Knock, &amp; the door will be opened. -Luke 11:9"
862893735620857858,2017-05-12 04:54:33,I know that God will give you whatever you ask of him. -John 11.22.
862880973700173828,2017-05-12 04:03:50,Jesus replied: Love the Lord your God with all your heart &amp; with all your soul &amp; with all your mind. -Matthew 22:37
862868088760541185,2017-05-12 03:12:38,"Happy moments: Praise God

Difficult moments: Seek God

Quiet moments: Worship God

Difficult moments: Trust God

Every moment: Thank God"
862855185923788800,2017-05-12 02:21:22,"Satan seeks to defeat you by tempting you to trust your own wisdom, to live according to ur self-centered feelings and to gratify your flesh"
862854126648119296,2017-05-12 02:17:09,RT @llovmycat: Beautiful! https://t.co/qg1Xmwo35u
862842557482532864,2017-05-12 01:31:11,"Jesus said to him, ""I am the way, and the truth, and the life; no one comes to the Father but through Me."" -John 14:6"
862839021554323456,2017-05-12 01:17:08,"RT @The_Gospels: But God demonstrates His own love toward us, in that while we were yet sinners, Christ died for us. -Romans 5:8"
862829629131771904,2017-05-12 00:39:48,Love the Lord your God with all your heart &amp; with all your soul &amp; with all your mind &amp; with all your strength. -Mark 12:30
862818959023890432,2017-05-11 23:57:24,RT @LifeLimits: I really DO Babe! To the FRIDGE and back! https://t.co/gDS9qHXeW0 https://t.co/dx1nfF2ZHG
862816864614981632,2017-05-11 23:49:05,"God not only sees where you are, He sees where you can be."
862804005247954944,2017-05-11 22:57:59,Trusting God is more than what you can see. Walk by FAITH not by sight.
862791119263985664,2017-05-11 22:06:47,"Without love we don't feel anything.
Without dreams we don't accomplish anything.
Without God we aren't anything."
862778518706499585,2017-05-11 21:16:43,RT @FaithReeI: People Are Flocking To See A Real Life Size Replica Of Noah’s Ark &amp; It’s Absolutely Amazing! Click&gt;&gt; https://t.co/hd7hrBcjjm…
862778384941764608,2017-05-11 21:16:11,"As churning the milk produces butter, and as twisting the nose produces blood, so stirring up anger produces strife. -Proverbs 30:33"
862765505299480581,2017-05-11 20:25:00,"God is our refuge and strength, a very present help in trouble. -Psalms 46:1"
862752656632238080,2017-05-11 19:33:57,Satan seeks to defeat you by tempting you to trust your own wisdom. TRUST IN GOD.
862748310385381380,2017-05-11 19:16:40,"RT @TabithaKhaye: This Champion Dance Group Has Gone Viral.  Must See!        
Click&gt;-&gt; https://t.co/QCDQbU3tSo https://t.co/8xgfVL0vEd"
862739937304727552,2017-05-11 18:43:24,You are a child of God. You're playing small does not serve the world. There is nothing enlightened about shrinking.
862726898794848258,2017-05-11 17:51:36,I put on the Full Armor of God -Ephesians 6:10
862714367170752512,2017-05-11 17:01:48,Love the Lord your God with all your heart &amp; with all your soul &amp; with all your mind. This is the first &amp; greatest commandment. -Matt 22:37
862703044982657024,2017-05-11 16:16:48,"RT @FaithReeI: Men Said “Labor/Birth Pain Isn’t That Bad,” Then They Try A Labor Simulator.  Lol! Click&gt;&gt;https://t.co/G4e0rfL2oe https://t.…"
862701199434407936,2017-05-11 16:09:28,Be on your guard; stand firm in the faith; be men of courage; be strong. -1Cor 16:13
862688375740018689,2017-05-11 15:18:31,"What is desired in a man is kindness, &amp; a poor man is better than a liar. -Proverbs 19:22"
862675534421139457,2017-05-11 14:27:29,"If ye love me, keep my commandments. -John 14:15"
862662797657870336,2017-05-11 13:36:53,"The tongue has the power of life and death, and those who love it will eat its fruit. -Proverbs 18:21"
862650056285061120,2017-05-11 12:46:15,"The thief comes only to steal &amp; kill &amp; destroy; I have come that they may have life, &amp; have it to the full. -John 10:10"
862642766697947137,2017-05-11 12:17:17,RT @LifeLimits: Sometimes it just happens… -&gt; https://t.co/8WezTYlwd9 https://t.co/cCFaP9InXj
862637023877898240,2017-05-11 11:54:28,"You may have weaknesses, but God has strength. You may have sin, but God has grace. You may fail, but God remains faithful!"
862624164758376448,2017-05-11 11:03:22,"I pray that the Lord, who gives peace, will always bless you with peace. May the Lord be with all of you too. -Thess 3:16"
862611503870078976,2017-05-11 10:13:03,Draw near to God and He will draw near to you! -James 4:8
862598484247146497,2017-05-11 09:21:19,"For it is by grace you have been saved, through faith; and this is not from yourselves, it is the gift of God; -Ephesians 2:8"
862585806610976770,2017-05-11 08:30:57,"Love is patient, love is kind and is not jealous; love does not brag and is not arrogant -1 Corinthians 13:4"
862572893112328193,2017-05-11 07:39:38,"Do not be anxious about anything, but in everything, by prayer &amp; petition, w/ thanksgiving, present your requests 2 God. -Phil 4:6"
862559977420050432,2017-05-11 06:48:18,"For I know the plans I have for you, declares the LORD, plans to prosper u &amp; not to harm you, plans to give you hope &amp; a future. -Jer 29:11"
862547277302427648,2017-05-11 05:57:50,Self-restraint &amp; gentle speech are effective against stubborn opposition.
862534396456443906,2017-05-11 05:06:39,Don't procrastinate — there's no time to lose. -Proverbs 6:4
862521565799481345,2017-05-11 04:15:40,"When you are tempted, he will provide a way out so that you can stand up under it. -1Cor 10:13"
862508878554177536,2017-05-11 03:25:15,"He who believes in the Son has eternal life; but he who does not obey the Son will not see life, but the wrath of God abides on him. Jn 3:36"
862496026518855680,2017-05-11 02:34:11,"You ask [in prayer] but don't receive it because you ask wrongly, wanting to squander it on pleasure -James 4:3"
862491722697383936,2017-05-11 02:17:05,RT @amotherjoy: The Power of a Mother's Love https://t.co/XaMybJva6C
862483190178607105,2017-05-11 01:43:11,It was for freedom that Christ set us free; therefore keep standing firm and do not be subject again to a yoke of slavery. -Galatians 5:1
862476651048964096,2017-05-11 01:17:12,"RT @God_Loved: Have faith, God will provide. https://t.co/AL41O0Lger"
862470148753633280,2017-05-11 00:51:22,"God's will is not an itinerary, but an attitude.  -Andrew Dhuse"
862469291056254977,2017-05-11 00:47:57,RT @Inspire_Us: Typical Cat Person. Cats &gt; People. -&gt; https://t.co/Tp3ZcLxnvH https://t.co/YdwkbeSpaR
862457766354575360,2017-05-11 00:02:09,"If you can believe, all things are possible to him who believeth. -Mark 9:23"
862444462068334594,2017-05-10 23:09:17,Some say: God loves us if we change. The Gospel says: God's love CHANGES us.
862431872370040836,2017-05-10 22:19:16,I know that God will give you whatever you ask of him. -John 11.22.
862418829158346752,2017-05-10 21:27:26,Those who mock the poor insult their Maker; those who rejoice at the misfortune of others will be punished. -Proverbs 17:5
862406008311820289,2017-05-10 20:36:29,"He who conceals his hatred has lying lips, and whoever spreads slander is a fool. -Proverbs 10:18"
862393220432572417,2017-05-10 19:45:40,"Blessed are the peacemakers, for they will be called children of God. -Matthew 5.9"
