id,created_at,text
854962113361608704,2017-04-20 07:37:06,"If you can't control what you think, you will not be able to control what you do."
854949284361498625,2017-04-20 06:46:08,Jesus Gives Hope.
854936261546606596,2017-04-20 05:54:23,"Frustration, complication, and misery are available in abundance, but so is God's grace."
854923756992700417,2017-04-20 05:04:42,"Walk boldly through the doors God opens for you, and don't become discouraged when He closes one."
854910884413624320,2017-04-20 04:13:32,"When you take time with God and listen to His voice, He renews your strength and enables you to handle life."
854897745638903808,2017-04-20 03:21:20,For God alone my soul waits in silence. -Psalm 62:1
854885246491385857,2017-04-20 02:31:40,And nothing will be impossible for you. -Matthew 17.20
854881566295814144,2017-04-20 02:17:02,RT @mother_know: LOL https://t.co/WuaEnVKqRn
854874999697657858,2017-04-20 01:50:57,RT @JarridWilson: Just because someone speaks truth into your life that you don't like hearing doesn't mean that person is speaking negativ…
854872151756853248,2017-04-20 01:39:38,"For I am with you, &amp; no one is going to attack &amp; harm you, because I have many people in this city. -Acts 18:10"
854866455892021248,2017-04-20 01:17:00,"RT @Bible_Time: God is the best part of my life. Without Him, I can't imagine where I'd be."
854859424414019585,2017-04-20 00:49:03,God + u = all u need
854854300165709824,2017-04-20 00:28:42,"RT @FaithReeI: Grandma Teaching Adorable 8 Wk Old Baby Sign Language, Aww, Must see! Click&gt;&gt;https://t.co/32BAeGrjSe https://t.co/WoxwLH5zLc"
854853405998809088,2017-04-20 00:25:09,RT @Quote_Soup: Dream Big. Dream OFTEN. -&gt; https://t.co/sfrAA1yAnd https://t.co/capUYkuwWT
854846491596337152,2017-04-19 23:57:40,"One night the Lord spoke to Paul in a vision: ""Do not be afraid; keep on speaking, do not be silent."" -Acts 18:9"
854833689188028417,2017-04-19 23:06:48,I am a Christian. That does not mean I am perfect. Just forgiven.
854820925488988160,2017-04-19 22:16:05,"God has a bright future in store for you!
 - Keep standing
 - Keep believing
 - Keep hoping"
854808080269410304,2017-04-19 21:25:02,Be on your guard; stand firm in the faith; be men of courage; be strong. -1Corinthians 16:13
854795194880937984,2017-04-19 20:33:50,"Create in me a clean heart, O God. -Psalm 51.10"
854782233806295040,2017-04-19 19:42:20,Love is not a feeling we have; it's a decision to treat people the way Jesus would treat them.
854769454340861955,2017-04-19 18:51:33,In God we will be strong - Psalm 60:12
854760723519504395,2017-04-19 18:16:51,"RT @FwJesus: Don't mourn bad decisions, overcome them with good ones."
854756752293756932,2017-04-19 18:01:05,"I pray to you, my protector. -Psalm 57:2"
854743900426252289,2017-04-19 17:10:00,"A friend loves at all times, &amp; a brother is born for adversity. - Prov 17:17"
854731028778373120,2017-04-19 16:18:52,"You will be secure, because there is hope; you will look about you &amp; take your rest in safety. -Job 11:18"
854718179192471552,2017-04-19 15:27:48,"Submit yourselves therefore to God. Resist the devil, and he will flee from you. -James 4:7"
854705296631095296,2017-04-19 14:36:37,Humility and the fear of the LORD bring wealth and honor and life. -Proverbs 22:4
854692603874463744,2017-04-19 13:46:10,"Whatever is true, whatever is noble, right, pure, lovely, admirable, excellent or praiseworthy - think of such things. -Phil 4:8"
854679678757556224,2017-04-19 12:54:49,Every word of God is pure; He is a shield unto them that put their trust in him. -Proverbs 30:5
854670201106952193,2017-04-19 12:17:09,RT @amotherjoy: So innocent https://t.co/n6Jt42iRKC
854666709772455936,2017-04-19 12:03:17,"And He said. ""Your faith has made you well; go in peace."" -Luke 8:48"
854653972984082434,2017-04-19 11:12:40,For all have sinned and fall short of the glory of God. -Romans 3:23
854641143287615489,2017-04-19 10:21:41,Anyone who does not do what is right is not a child of God; nor is anyone who does not love his brother. -1John 3:10
854628478519586816,2017-04-19 09:31:22,"God is spirit, and his worshipers must worship in the Spirit and in truth. -John 4:24"
854615405108875264,2017-04-19 08:39:25,The God who made the world &amp; everything in it is the Lord of heaven &amp; earth &amp; does not live in temples built by hands. -Acts 17:24
854602568571510785,2017-04-19 07:48:24,Disappointments were not meant to destroy you. They were meant to strengthen you &amp; give you fortitude to accomplish your God-given destiny.
854589810375262208,2017-04-19 06:57:42,Never underestimate the power of a prayer. One small prayer can change your life dramatically.
854577003978260480,2017-04-19 06:06:49,"Don't worry if you're single. God is looking at you right now, saying, ""I'm saving this one for someone special"""
854564082082623489,2017-04-19 05:15:28,What God intended for you goes far beyond anything you can imagine. Never lose hope and hang on to God's hand.
854551200578105344,2017-04-19 04:24:17,"Always keep your head up, because if it's down you won't be able to see the blessings that have been placed in your life."
854538578893959170,2017-04-19 03:34:08,I have faith that God is living out a divine plan through me. Have faith in God. -Mark 11:22
854525701499891713,2017-04-19 02:42:58,"Many books can INFORM you, but the Bible can TRANSFORM you."
854512819169112064,2017-04-19 01:51:46,"If you do good to those who are good to you, what credit is that to you? Even ""sinners"" do that. -Luke 6:33"
854504070840766466,2017-04-19 01:17:01,"RT @Bible_Time: Jesus answered, ""I am the way and the truth &amp; the life. No one comes to the Father except through me. -John 14:6"
854500163137802242,2017-04-19 01:01:29,It is your Father's good pleasure to give you the kingdom. -Luke 12.32
854487076028469248,2017-04-19 00:09:29,"Happiness is not based on your circumstances, but on a decision you make."
854474295938093056,2017-04-18 23:18:42,Love your enemies. Do good to those who hate you. Speak well of those who curse you. -Luke 6:27-28
854461578737004544,2017-04-18 22:28:10,"7 days without prayer makes one ""weak"" :)"
854448594295939073,2017-04-18 21:36:34,Trust the LORD &amp; his mighty power. -Psalm 105:4
854435774460289024,2017-04-18 20:45:37,Trust in Him!
854422983779201024,2017-04-18 19:54:48,Now faith is being sure of what we hope for &amp; certain of what we do not see. -Hebrews 11:1
854413376998584320,2017-04-18 19:16:37,RT @The_Gospels: Looking for more? Visit -&gt; https://t.co/1qRf0GTTd3 https://t.co/1fqFfdcqyI
854410079105318912,2017-04-18 19:03:31,Let go of the disappointments and setbacks in your life and hang on to the promises of God for your future.
854398396966346753,2017-04-18 18:17:06,"RT @The_Gospels: So then, just as you received Christ Jesus as Lord, continue to live your lives in him. -Colossians 2:6"
854397335882919941,2017-04-18 18:12:53,Fight the good fight of the faith. Take hold of the eternal life to which you were called. -1Tim 6:12
854384485592428545,2017-04-18 17:21:49,It is you who made the heavens and the earth by your great power. Nothing is too hard for you. -Jeremiah 32:17
854371741480747009,2017-04-18 16:31:11,Each person you meet is Jesus in disguise. -Mother Teresa
854358931753373699,2017-04-18 15:40:17,"Above all, love each other deeply, because love covers over a multitude of sins. -1Peter 4:8"
854345892287131649,2017-04-18 14:48:28,The Lord is… at my right hand so that I won't be shaken - Acts 2:25
854333181310492672,2017-04-18 13:57:57,I tell you not to worry about your life. -Matthew 6:25
854320267241242624,2017-04-18 13:06:38,"But even when I am afraid, I keep on trusting you. -Psalm 56:3"
854307635130191873,2017-04-18 12:16:27,Delight yourself in the LORD &amp; he'll give you the desires of your heart. -Psalm 37:4
854294713427517441,2017-04-18 11:25:06,"In your relationships with one another, have the same attitude of mind Christ Jesus had: -Philippians 2:5"
854281785705934850,2017-04-18 10:33:44,God remains in us and his love in us is made complete. -1John 4:12
854269037320298496,2017-04-18 09:43:04,I consider that our present sufferings are not worth comparing with the glory that will be revealed in us. -Romans 8:18
854256006695616513,2017-04-18 08:51:17,"Jesus said, ""For mortals it is impossible, but for God all things are possible. -Mat 19:26"
854243518767923200,2017-04-18 08:01:40,When I think of all the stuff I've been through I have confidence I can get through this. I trust that God will take care of me.
854230495001022464,2017-04-18 07:09:55,With God all things are possible. -Matthew 19:26
854217527399985152,2017-04-18 06:18:23,"Jesus answered, ""I am the way &amp; the truth &amp; the life. No one comes to the Father except through me. -John 14:6"
854204902419177472,2017-04-18 05:28:13,Respect those… who caution you -1 Thessalonians 5:12
854191901033074688,2017-04-18 04:36:33,"I fall asleep in peace the moment I lie down because you alone, O LORD, enable me to live securely. -Psalm 4.8"
854179356700291072,2017-04-18 03:46:43,"Before his downfall a man's heart is proud, but humility comes before honor. -Proverbs 18:12"
854166171398090752,2017-04-18 02:54:19,"He was crushed for our iniquities; the punishment that brought us peace was upon him, &amp; by his wounds we are healed. -Isa 53:5"
854156806259707908,2017-04-18 02:17:06,RT @mother_know: True. https://t.co/0J8w7WQYVn
854153447649800197,2017-04-18 02:03:45,Never lose faith. God loves you too much to let you down.
854141695981748224,2017-04-18 01:17:04,RT @daiIyscripture: https://t.co/RCPgzrVYUL
854140592997183492,2017-04-18 01:12:41,"Cast all your anxiety on him, because he cares for you. -1Peter 5.7"
854127791369007105,2017-04-18 00:21:49,"Unless you change and become like little children, you will never enter the kingdom of heaven. -Matthew 18:3"
854115156657393664,2017-04-17 23:31:36,Great peace have those who love your law; nothing can make them stumble. -Psalm 119.165
854105098687053824,2017-04-17 22:51:38,RT @Quote_Soup: I have yet to begin…RT if this has EVER been YOU! --&gt; https://t.co/lqPWk4Kf5Q https://t.co/jv84EPQQ5J
854101997678669824,2017-04-17 22:39:19,God Is There Even When You're At Your Lowest. He's Working Things Out Even When You Don't Know It.
854089261863378945,2017-04-17 21:48:42,"The Lord will be a refuge for the oppressed, a refuge for times of trouble - Psalm 9:9"
854081220971560961,2017-04-17 21:16:45,"RT @FaithReeI: You will turn back to me &amp; ask for help, &amp; I will answer your prayers - Jer 29:12"
854076425946755073,2017-04-17 20:57:42,The Lord's word is pure - Psalm 18:30.
854063790010372098,2017-04-17 20:07:29,A positive attitude gives you power over your circumstances instead of your circumstances having power over you.
854051003825614848,2017-04-17 19:16:41,"RT @The_Gospels: Amen. To sign-up for our daily emails, Visit -&gt; https://t.co/1qRf0GTTd3 https://t.co/nAO2Abmxkq"
854050990751875072,2017-04-17 19:16:38,"Be strong &amp; take heart, all you who hope in the LORD. Psalm. 31:24"
854038041673035778,2017-04-17 18:25:11,Make every effort to live in peace with everyone and to be holy; without holiness no one will see the Lord. -Hebrews 12:14
854035980705308672,2017-04-17 18:16:59,RT @LovLikeJesus: Availability is better than ability for God.
854025325948391424,2017-04-17 17:34:39,Wishing will NEVER be a substitute for prayer.
854012186884231168,2017-04-17 16:42:26,"Praise be to the God and Father of our Lord Jesus Christ, the Father of compassion &amp; the God of all comfort. -2Cor 1:3"
854005719082950656,2017-04-17 16:16:44,"RT @FaithReeI: Remaining calm in adversity is a sign of great spiritual strength. No matter what's going on in your life right now, ""Hold y…"
853999321821442048,2017-04-17 15:51:19,"If we say that we have no sin, we are deceiving ourselves and the truth is not in us. -1 John 1:8"
853986864902135810,2017-04-17 15:01:49,"Knock, &amp; the door will be opened. -Luke 11:9"
853973695345430529,2017-04-17 14:09:29,I know that God will give you whatever you ask of him. -John 11.22.
853960827992518660,2017-04-17 13:18:21,Jesus replied: Love the Lord your God with all your heart &amp; with all your soul &amp; with all your mind. -Matthew 22:37
853948200616591360,2017-04-17 12:28:11,"Happy moments: Praise God

Difficult moments: Seek God

Quiet moments: Worship God

Difficult moments: Trust God

Every moment: Thank God"
853945375937495044,2017-04-17 12:16:57,"RT @mother_know: So funny, love this. https://t.co/hlOqUXyvDM"
853935200052666369,2017-04-17 11:36:31,"Satan seeks to defeat you by tempting you to trust your own wisdom, to live according to ur self-centered feelings and to gratify your flesh"
853922356141715456,2017-04-17 10:45:29,"Jesus said to him, ""I am the way, and the truth, and the life; no one comes to the Father but through Me."" -John 14:6"
853909576474820608,2017-04-17 09:54:42,Love the Lord your God with all your heart &amp; with all your soul &amp; with all your mind &amp; with all your strength. -Mark 12:30
853896823970443264,2017-04-17 09:04:02,"God not only sees where you are, He sees where you can be."
853883925072097281,2017-04-17 08:12:46,Trusting God is more than what you can see. Walk by FAITH not by sight.
853871002002096129,2017-04-17 07:21:25,"Without love we don't feel anything.
Without dreams we don't accomplish anything.
Without God we aren't anything."
853858372675928064,2017-04-17 06:31:14,"As churning the milk produces butter, and as twisting the nose produces blood, so stirring up anger produces strife. -Proverbs 30:33"
853845477909032960,2017-04-17 05:40:00,"God is our refuge and strength, a very present help in trouble. -Psalms 46:1"
853832572773822465,2017-04-17 04:48:43,Satan seeks to defeat you by tempting you to trust your own wisdom. TRUST IN GOD.
853819648055398402,2017-04-17 03:57:21,You are a child of God. You're playing small does not serve the world. There is nothing enlightened about shrinking.
853807089889583104,2017-04-17 03:07:27,I put on the Full Armor of God -Ephesians 6:10
853794053783257088,2017-04-17 02:15:39,Love the Lord your God with all your heart &amp; with all your soul &amp; with all your mind. This is the first &amp; greatest commandment. -Matt 22:37
853781231036755969,2017-04-17 01:24:42,Be on your guard; stand firm in the faith; be men of courage; be strong. -1Cor 16:13
853780076466511874,2017-04-17 01:20:07,RT @FwJesus: What a great shirt in time for Easter. --&gt; https://t.co/xJy65hir7Y https://t.co/6AXkmbNizP
853779280022708224,2017-04-17 01:16:57,RT @BookOProverbs: The good-hearted understand what it's like to be poor; the hardhearted haven't the faintest idea. -Proverbs 29:7
853768361540505600,2017-04-17 00:33:34,"What is desired in a man is kindness, &amp; a poor man is better than a liar. -Proverbs 19:22"
853755766515392512,2017-04-16 23:43:31,"If ye love me, keep my commandments. -John 14:15"
853742844410044419,2017-04-16 22:52:10,"The tongue has the power of life and death, and those who love it will eat its fruit. -Proverbs 18:21"
853730105595760641,2017-04-16 22:01:33,"The thief comes only to steal &amp; kill &amp; destroy; I have come that they may have life, &amp; have it to the full. -John 10:10"
853717025033736194,2017-04-16 21:09:34,"You may have weaknesses, but God has strength. You may have sin, but God has grace. You may fail, but God remains faithful!"
853704190870401024,2017-04-16 20:18:34,"I pray that the Lord, who gives peace, will always bless you with peace. May the Lord be with all of you too. -Thess 3:16"
853691480548028416,2017-04-16 19:28:04,Draw near to God and He will draw near to you! -James 4:8
853688626701631488,2017-04-16 19:16:44,RT @The_Gospels: Become a member of our email community. Visit -&gt; https://t.co/1qRf0GTTd3 to signup https://t.co/JRxCyUQbG0
853678519825641473,2017-04-16 18:36:34,"For it is by grace you have been saved, through faith; and this is not from yourselves, it is the gift of God; -Ephesians 2:8"
853673608471826437,2017-04-16 18:17:03,RT @The_Gospels: Peace comes when you pray.
853665808991629312,2017-04-16 17:46:03,"Love is patient, love is kind and is not jealous; love does not brag and is not arrogant -1 Corinthians 13:4"
853652811384541184,2017-04-16 16:54:24,"Do not be anxious about anything, but in everything, by prayer &amp; petition, w/ thanksgiving, present your requests 2 God. -Phil 4:6"
853640037937934337,2017-04-16 16:03:39,"For I know the plans I have for you, declares the LORD, plans to prosper u &amp; not to harm you, plans to give you hope &amp; a future. -Jer 29:11"
853627211475300352,2017-04-16 15:12:41,Self-restraint &amp; gentle speech are effective against stubborn opposition.
853614440964657156,2017-04-16 14:21:56,Don't procrastinate — there's no time to lose. -Proverbs 6:4
853601738594668544,2017-04-16 13:31:28,"When you are tempted, he will provide a way out so that you can stand up under it. -1Cor 10:13"
853596581156843523,2017-04-16 13:10:58,RT @JesusGraces: He is risen. Get your's here --&gt; https://t.co/Kda60PEhUX https://t.co/uicgL8DM09
853588793697460225,2017-04-16 12:40:01,"He who believes in the Son has eternal life; but he who does not obey the Son will not see life, but the wrath of God abides on him. Jn 3:36"
853582999224549376,2017-04-16 12:17:00,RT @mother_know: Do you agree? https://t.co/yeOgT76xcM
853575964172976129,2017-04-16 11:49:03,"You ask [in prayer] but don't receive it because you ask wrongly, wanting to squander it on pleasure -James 4:3"
853563060916801540,2017-04-16 10:57:46,It was for freedom that Christ set us free; therefore keep standing firm and do not be subject again to a yoke of slavery. -Galatians 5:1
853550271208804353,2017-04-16 10:06:57,"God's will is not an itinerary, but an attitude.  -Andrew Dhuse"
853537374864900096,2017-04-16 09:15:42,"If you can believe, all things are possible to him who believeth. -Mark 9:23"
853524468903399424,2017-04-16 08:24:25,Some say: God loves us if we change. The Gospel says: God's love CHANGES us.
853511690662674432,2017-04-16 07:33:39,I know that God will give you whatever you ask of him. -John 11.22.
853499052700389376,2017-04-16 06:43:26,Those who mock the poor insult their Maker; those who rejoice at the misfortune of others will be punished. -Proverbs 17:5
853485942308581376,2017-04-16 05:51:20,"He who conceals his hatred has lying lips, and whoever spreads slander is a fool. -Proverbs 10:18"
853473282892464128,2017-04-16 05:01:02,"Blessed are the peacemakers, for they will be called children of God. -Matthew 5.9"
853460423827476481,2017-04-16 04:09:56,"A man can no more diminish God's glory by refusing 2 worship him than a lunatic can put out the sun by scribbling the word, 'darkness'"
853447482784854016,2017-04-16 03:18:30,I can't believe that God put us on this earth to be ordinary. -Lou Holtz
853434690690318337,2017-04-16 02:27:40,"He that believeth on me, as the scripture hath said, out of his belly shall flow rivers of living water. -John 7:38"
853432008042827777,2017-04-16 02:17:01,RT @llovmycat: Roar? More like a Meow! https://t.co/lYoGZmVplM
853421790697316355,2017-04-16 01:36:25,Anyone who does not do what is right is not a child of God; nor is anyone who does not love his brother. -1John 3:10
853416897731276800,2017-04-16 01:16:58,"RT @God_Loved: Hatred stirs up dissension, but love covers over all wrongs. -Prov 10:12"
853409066508537858,2017-04-16 00:45:51,"Hatred stirs up dissension, but love covers over all wrongs. -Proverbs 10:12"
853396109036748802,2017-04-15 23:54:22,Pray that we may be given a hunger &amp; burning desire to fellowship more closely with Jesus
853388382063517697,2017-04-15 23:23:40,RT @Epic_Women: SHOP EARLY &amp; show MOM you think she's a CLASSY LADY! Makes a great MOTHER'S DAY GIFT. Click&gt;&gt;https://t.co/qVsKKrMzh2 https:…
853383347933937664,2017-04-15 23:03:39,"I love you, O LORD, my strength. -Psalm 18:1"
853380928709767174,2017-04-15 22:54:03,RT @LifeLimits: Can't get any better than these 3 -&gt; https://t.co/xRdUA89EaR https://t.co/JAl6pRy8Pm
853370505776312320,2017-04-15 22:12:38,Everyone who calls on the name of the Lord will be saved. -Romans 10:13
853357817264295936,2017-04-15 21:22:12,"If we confess our sins, he is faithful &amp; just &amp; will forgive us ur sins &amp; purify us from all unrighteousness. -1John 1:9"
853345045977731073,2017-04-15 20:31:28,"And the crooked shall be made straight, &amp; the rough ways shall be made smooth. -Luke 3.5"
853332075868553216,2017-04-15 19:39:55,"If you love Me, you will keep My commandments. -John 14:15"
853326202551054337,2017-04-15 19:16:35,RT @The_Gospels: Want to be a part of our community? Visit -&gt; https://t.co/1qRf0GTTd3 &amp; sign up for our daily emails. https://t.co/0NnhpckD…
853319127519440897,2017-04-15 18:48:28,"A patient man has great understanding, but a quick-tempered man displays folly. -Prov 14:25"
853306467507740674,2017-04-15 17:58:10,"We know that in all things God works for the good of those who love him, who have been called according to his purpose. -Romans 8:28"
853300484114960384,2017-04-15 17:34:23,RT @LovLikeJesus: Check out this beauty! Top Seller!  Limited time offer &amp; Availability!  -&gt; https://t.co/sgm6uadaOD https://t.co/sCCqXLcX6F
853293775526998016,2017-04-15 17:07:44,"Apply your heart to instruction, and your ears to words of knowledge. -Proverbs 23:12"
853280821159108611,2017-04-15 16:16:15,Trust in the LORD with all your heart &amp; lean not on your own understanding. -Prov 3:5
853267983505948672,2017-04-15 15:25:14,Jesus Christ was delivered over to death for our sins and was raised to life for our justification. -Romans 4:25
853266170954338306,2017-04-15 15:18:02,"RT @LifeLimits: You-nique, what's wrong with that? Get this shirt for the introvert in your crew. --&gt; https://t.co/WGbWSkOkTr https://t.co/…"
853255352829313025,2017-04-15 14:35:03,"They said, ""Believe in the Lord Jesus, and you will be saved..."" -Acts 16:31"
853242408414457857,2017-04-15 13:43:37,"No one has ever seen God; but if we love one another, God lives in us and his love is made complete in us. -1John 4:12"
853229318650163200,2017-04-15 12:51:36,The righteousness that comes from God &amp; is by faith. -Phil 3:9
853220613267259392,2017-04-15 12:17:00,RT @TabithaKhaye: A daughter is one of the most BEAUTIFUL gifts this world has to give. -Laurel Atherton
853216858484465670,2017-04-15 12:02:05,Pray for those who threaten you. -Luke 6:28
853203720234049537,2017-04-15 11:09:53,"You're not a failure until you stop trying. If you have no other testimony you have this one: ""I'm still here."""
853190859231285250,2017-04-15 10:18:47,Rejoice in the Lord always. I will say it again: Rejoice! -Philippians 4:4
853177999004401664,2017-04-15 09:27:40,One of the best gifts we can give ourselves is time alone with God.
853165173271654403,2017-04-15 08:36:43,Love the Lord your God with all your heart &amp; with all your soul &amp; w/ all your mind. This is the 1st &amp; greatest commandment. -Matthew 22:37
853152389796429824,2017-04-15 07:45:55,"In your anger do not sin. Do not let the sun go down while you are still angry, &amp; do not give the devil a foothold. -Eph 4:26"
853139533042524161,2017-04-15 06:54:49,"If we confess our sins, he is faithful and just and will forgive us our sins and purify us from all unrighteousness. -1John 1:9"
853126947223871488,2017-04-15 06:04:49,"Look, I am coming soon! My reward is with me, and I will give to everyone according to what they have done. -Revelation 22:12"
853113731806625792,2017-04-15 05:12:18,I know that God will give you whatever you ask of him. -John 11.22.
853101275101179905,2017-04-15 04:22:48,Love the LORD your God with all your heart and with all your soul and with all your strength. -Deuteronomy 6:5
853088274008690688,2017-04-15 03:31:08,"If you love me, obey my commandments. -John 14:15"
853075259750313985,2017-04-15 02:39:25,"A man's own folly ruins his life, yet his heart rages against the LORD. -Proverbs 19:3"
853069625726251009,2017-04-15 02:17:02,RT @llovmydog: What did you say?  https://t.co/8ieAuSwczo
853062723856457728,2017-04-15 01:49:37,"But seek first his kingdom &amp; his righteousness, and all these things will be given to you as well. -Matthew 6:33"
853054516928884736,2017-04-15 01:17:00,RT @daiIyscripture: Thank you Lord. https://t.co/n2umWuCLxA
853049775180173313,2017-04-15 00:58:09,My soul finds rest in God alone; my salvation comes from him. -Psalm 62:1
853043431945510912,2017-04-15 00:32:57,RT @JarridWilson: The same sin that nailed Jesus to the cross is the very sin he willingly put himself on the cross to forgive. #GoodFriday
853036799815544833,2017-04-15 00:06:36,"Do not conform any longer to the pattern of this world, but be transformed by the renewing of your mind. -Romans 12:2"
853036360617295872,2017-04-15 00:04:51,"RT @God_Loved: HE will GUIDE YOU! Available for $19, sizes S-4x, &amp; 2 styles. -&gt; https://t.co/PRv5UnaTSA https://t.co/yfbcMKaMd7"
853023981632450560,2017-04-14 23:15:40,"The thief comes only to steal &amp; kill &amp; destroy; I have come that they may have life, &amp; have it to the full. -John 10:10"
853011166897065984,2017-04-14 22:24:45,"Friends come and go, but Jesus comes and stays."
852998558081052676,2017-04-14 21:34:38,Speak up for those who cannot speak for themselves; ensure justice for those being crushed. -Proverbs 31:8
852985450671288320,2017-04-14 20:42:33,Surely God is my salvation; I will trust and not be afraid. -Isaiah 12:2
852972786737975296,2017-04-14 19:52:14,"The life I live in the body, I live by faith in the Son of God, who loved me &amp; gave himself for me. -Gal 2:20"
852963822172295168,2017-04-14 19:16:37,"RT @The_Gospels: Amen. To sign-up for our daily emails, Visit -&gt; https://t.co/1qRf0GTTd3 https://t.co/c2OKEMcTY2"
